{
  "event_id": 20,
  "event_uuid": "018f5d8a-03fb-7df0-8e36-64d7410cfe20",
  "correlation_id": "session-1",
  "causation_event_id": null,
  "type": "project.registered",
  "actor_id": "agent-a",
  "source": "agent",
  "source_ref": "agent:codex:session-1",
  "payload": {
    "handle": "billing",
    "display_name": "Billing",
    "purpose": "Per-seat and per-org pricing decisions"
  },
  "ts": "2026-09-21T20:45:43Z"
}
